{
  "$schema": "http://json-schema.org/draft-07/schema#",
  "title": "horoscope_calculation_response",
  "type": "object",
  "required": [
    "contract_version",
    "service_code",
    "period",
    "slots",
    "calculation_warnings",
    "evidence_keys"
  ],
  "additionalProperties": false,
  "allOf": [
    {
      "if": {
        "properties": {
          "service_code": { "const": "horoscope_basic_daily_natal_3_slots" }
        },
        "required": ["service_code"]
      },
      "then": {
        "properties": {
          "slots": { "minItems": 3, "maxItems": 3 }
        }
      }
    },
    {
      "if": {
        "properties": {
          "service_code": { "const": "horoscope_free_daily" }
        },
        "required": ["service_code"]
      },
      "then": {
        "properties": {
          "slots": { "minItems": 1, "maxItems": 1 }
        }
      }
    },
    {
      "if": {
        "properties": {
          "service_code": { "const": "horoscope_premium_daily_local_2h_slots" }
        },
        "required": ["service_code"]
      },
      "then": {
        "properties": {
          "slots": {
            "minItems": 12,
            "maxItems": 12,
            "items": {
              "required": [
                "slot_code",
                "reference_local_time",
                "reference_datetime_utc",
                "sky_snapshot",
                "moon_context",
                "transits_to_natal",
                "current_sky_aspects",
                "natal_house_activations",
                "local_chart",
                "local_house_placements",
                "angle_activations"
              ]
            }
          }
        }
      }
    }
  ],
  "properties": {
    "contract_version": { "const": "horoscope_calculation_response" },
    "service_code": {
      "enum": [
        "horoscope_basic_daily_natal_3_slots",
        "horoscope_free_daily",
        "horoscope_premium_daily_local_2h_slots"
      ]
    },
    "period": {
      "type": "object",
      "required": ["date", "timezone"],
      "additionalProperties": false,
      "properties": {
        "date": { "type": "string" },
        "timezone": { "type": "string" }
      }
    },
    "slots": {
      "type": "array",
      "minItems": 1,
      "maxItems": 12,
      "items": {
        "type": "object",
        "required": [
          "slot_code",
          "reference_local_time",
          "sky_snapshot",
          "moon_context",
          "transits_to_natal",
          "current_sky_aspects",
          "natal_house_activations"
        ],
        "properties": {
          "slot_code": { "type": "string" },
          "reference_local_time": { "type": "string" },
          "reference_datetime_utc": { "type": "string" },
          "sky_snapshot": { "type": "object" },
          "moon_context": { "type": "object" },
          "transits_to_natal": { "type": "array" },
          "current_sky_aspects": { "type": "array" },
          "natal_house_activations": { "type": "array" },
          "local_chart": { "type": "object" },
          "local_house_placements": { "type": "array" },
          "angle_activations": { "type": "array" },
          "calculation_warnings": { "type": "array" }
        }
      }
    },
    "calculation_warnings": { "type": "array" },
    "evidence_keys": {
      "type": "array",
      "items": { "type": "string" }
    }
  }
}
